{
	"name": "v1-minimal-config",
	"description": "Minimal required attributes only",
	"blockVersion": "v1",
	"chartType": "bar",
	"featureTags": ["minimal-config"],
	"serializedContent": "<!-- wp:prc-chart-builder/chart {\"chartType\":\"bar\"} -->\n<div class=\"wp-block-prc-chart-builder-chart\"></div>\n<!-- /wp:prc-chart-builder/chart -->",
	"expectedMigratedAttributes": {
		"_version": "v2",
		"layout": {
			"type": "bar"
		}
	}
}
