{
	"name": "v1-line-with-legend",
	"description": "Line chart with legend and custom colors",
	"blockVersion": "v1",
	"chartType": "line",
	"featureTags": ["legend", "custom-colors"],
	"serializedContent": "<!-- wp:prc-chart-builder/chart {\"chartType\":\"line\",\"width\":640,\"height\":400,\"legendActive\":true,\"legendOrientation\":\"row\",\"legendCategories\":[\"Series A\",\"Series B\"],\"customColors\":[\"#436983\",\"#bf3927\"]} -->\n<div class=\"wp-block-prc-chart-builder-chart\"></div>\n<!-- /wp:prc-chart-builder/chart -->",
	"expectedMigratedAttributes": {
		"_version": "v2",
		"layout": {
			"type": "line",
			"width": 640,
			"height": 400
		},
		"legend": {
			"active": true,
			"orientation": "row",
			"categories": ["Series A", "Series B"]
		},
		"colors": ["#436983", "#bf3927"]
	}
}
