{
	"name": "v1-annotations-plotbands",
	"description": "Chart with annotations and plot bands",
	"blockVersion": "v1",
	"chartType": "line",
	"featureTags": ["annotations", "plot-bands"],
	"serializedContent": "<!-- wp:prc-chart-builder/chart {\"chartType\":\"line\",\"width\":640,\"height\":400,\"plotBandsActive\":true,\"plotBands\":[{\"dimension\":\"x\",\"from\":2020,\"to\":2021,\"fill\":\"#f0f0f0\"}],\"annotationsActive\":true,\"annotations\":[{\"x\":2020,\"y\":50,\"text\":\"Important Event\"}]} -->\n<div class=\"wp-block-prc-chart-builder-chart\"></div>\n<!-- /wp:prc-chart-builder/chart -->",
	"expectedMigratedAttributes": {
		"_version": "v2",
		"layout": {
			"type": "line",
			"width": 640,
			"height": 400
		},
		"plotBands": {
			"active": true,
			"bands": [
				{
					"dimension": "x",
					"from": 2020,
					"to": 2021,
					"fill": "#f0f0f0"
				}
			]
		},
		"annotations": {
			"active": true,
			"items": [
				{
					"x": 2020,
					"y": 50,
					"text": "Important Event"
				}
			]
		}
	}
}
